{
  "sample_id": "200003",
  "round_id": 1,
  "tool_name": "FakeShield",
  "status": "success",
  "score": 0.74,
  "label_support": {
    "none": 0.0,
    "copy_move": 0.08,
    "splice": 0.74,
    "inpainting_removal": 0.0,
    "inpainting_replacement": 0.14,
    "aigc_global": 0.0
  },
  "summary": "FakeShield baseline adapter favors `splice` under coarse label `manipulated`."
}