{
  "sample_id": "600008",
  "round_id": 1,
  "tool_name": "ForgeryGPT",
  "status": "success",
  "score": 0.84,
  "label_support": {
    "none": 0.84,
    "copy_move": 0.0,
    "splice": 0.04,
    "inpainting_removal": 0.0,
    "inpainting_replacement": 0.0,
    "aigc_global": 0.07
  },
  "summary": "ForgeryGPT baseline adapter prioritizes `none` for `classification`."
}